{
  "agreement": {
    "status": "not-determined"
  },
  "assignment_digests": [
    {
      "assignment_id": "assignment-4f3b17df19521ba99739a361",
      "candidate_digest": "sha256:73129dff908acfe62341853fc949baa782be4e2e454a0b106698bd728b3103aa",
      "evidence_digests": [
        "sha256:5dd126f962bb5f785285ac0152e0a6f098adbe18ff60ab2576f813653fd49623",
        "sha256:8cf1d9fd27fcb028b4a7a55fd7e59e7d436ebcf20fbb0826ca0bea9d0034cf2e",
        "sha256:26db22b0172aa614822c1fb65e5784f0b75fa132993009738ffcc0920885a35b",
        "sha256:24e575986f604c9ae61005e7a8105d185a031bbca7a67d772118ad3fa6bea775",
        "sha256:ced6e2cee7147462e9eff53388dfae217e44adc81b97b65e34673f85e66b3131",
        "sha256:802d3ce78323b0cbf5a8209cdcd87cfdf3005f38a6073ff5329b390aa2e18018"
      ],
      "negative_knowledge_digests": [
        "sha256:78e1bcd08b3e18c6554d5c925ff4956ff670285c4502d3144f2fb36a1e27a7dc",
        "sha256:c383d9438a29cd6e00cd00dad548c1b81a68c203814b30b90cc48da5427fd486",
        "sha256:47139e6ca7d8f5e0920296352f406a9c7a971c2dcf3f15e4b23a22431feddbad",
        "sha256:9045091652139e48a1a2226b8a2e953f38b99787753c4476c2ed5c4bf12e95f9"
      ],
      "source_digest": "sha256:0cb658910e73ad7fde7d365eea696b175414037268269b202d00204563fb44bb",
      "task_id": "task-08-reconciliation"
    },
    {
      "assignment_id": "assignment-4d7ba0e69d91e5456f4c3c4f",
      "candidate_digest": "sha256:80f5f56052c64997400ba8418bc2f0e6f564632b8a10b46be9571f7a6fc2b392",
      "evidence_digests": [
        "sha256:7c96480e20dcba413e05648b567d80b6cc5ba7aab27f2cb5fcfed986cc4ac269",
        "sha256:bc100e71fcbeba5e5a4003fa6b9049a977e1b16b88354704c3e9c4c33d71e8e3"
      ],
      "negative_knowledge_digests": [
        "sha256:78e1bcd08b3e18c6554d5c925ff4956ff670285c4502d3144f2fb36a1e27a7dc",
        "sha256:c383d9438a29cd6e00cd00dad548c1b81a68c203814b30b90cc48da5427fd486",
        "sha256:47139e6ca7d8f5e0920296352f406a9c7a971c2dcf3f15e4b23a22431feddbad",
        "sha256:9045091652139e48a1a2226b8a2e953f38b99787753c4476c2ed5c4bf12e95f9"
      ],
      "source_digest": "sha256:0cb658910e73ad7fde7d365eea696b175414037268269b202d00204563fb44bb",
      "task_id": "task-11-boundary-isolation"
    },
    {
      "assignment_id": "assignment-6785c2d65e906c098abbd047",
      "candidate_digest": "sha256:33fd808a1e8d14396d1a14cfb39296b444223150b9560a1c08e24ca829ff90dc",
      "evidence_digests": [
        "sha256:443bd24990788a8b2dfb4a525c1d06e0f3be33efb74631a1803de54ee5f49866",
        "sha256:64941064907c16ab6aeb8854b8dce3b73e0ad87bbb193c4eac778ea85811e548",
        "sha256:59dfe8b99edf449902df0527d9d58111fa650cc3e1140428d11db2a4c871309f",
        "sha256:7662b9a763f0288d05bb43bca40e0bd3bc706e60664fd4aafdec7f04b615c2bf"
      ],
      "negative_knowledge_digests": [
        "sha256:78e1bcd08b3e18c6554d5c925ff4956ff670285c4502d3144f2fb36a1e27a7dc",
        "sha256:c383d9438a29cd6e00cd00dad548c1b81a68c203814b30b90cc48da5427fd486",
        "sha256:47139e6ca7d8f5e0920296352f406a9c7a971c2dcf3f15e4b23a22431feddbad",
        "sha256:9045091652139e48a1a2226b8a2e953f38b99787753c4476c2ed5c4bf12e95f9"
      ],
      "source_digest": "sha256:0cb658910e73ad7fde7d365eea696b175414037268269b202d00204563fb44bb",
      "task_id": "task-05-stream-history"
    },
    {
      "assignment_id": "assignment-278649d08cad02472d6bfe28",
      "candidate_digest": "sha256:df43376ed4ed68db3934064be63164b66e410b8b733ac5aa438aaf6a939840ed",
      "evidence_digests": [
        "sha256:364c9d9e824b1b5f1133580e9147f3ab61ebc5e52bb5c8b72d082ca657e38ade",
        "sha256:183c6eaf9c973ca7fa086b24bec7dcf1b3ac0ee156bbcc1f61d0b14e82378969",
        "sha256:829d2168d0a077ab79b2f000abd82cace641d71fba46878194265a039d563776",
        "sha256:cbfbf0930b5f2998ab4b6750db65417a0c75ffac1d3fe80eaa1cc701a0162702",
        "sha256:67cf9fde68d051f9ce591a4782efc51ca97e57c87fe76cf5ce191216ce13472b"
      ],
      "negative_knowledge_digests": [
        "sha256:78e1bcd08b3e18c6554d5c925ff4956ff670285c4502d3144f2fb36a1e27a7dc",
        "sha256:c383d9438a29cd6e00cd00dad548c1b81a68c203814b30b90cc48da5427fd486",
        "sha256:47139e6ca7d8f5e0920296352f406a9c7a971c2dcf3f15e4b23a22431feddbad",
        "sha256:9045091652139e48a1a2226b8a2e953f38b99787753c4476c2ed5c4bf12e95f9"
      ],
      "source_digest": "sha256:0cb658910e73ad7fde7d365eea696b175414037268269b202d00204563fb44bb",
      "task_id": "task-01-storage-mechanism"
    },
    {
      "assignment_id": "assignment-d0de7bb62e1edf53cb5a62ce",
      "candidate_digest": "sha256:32a1069795c3db99309f127d9213bf23449b8b7cb5b008febf1cab50fd1e6ea1",
      "evidence_digests": [
        "sha256:5dd126f962bb5f785285ac0152e0a6f098adbe18ff60ab2576f813653fd49623",
        "sha256:8cf1d9fd27fcb028b4a7a55fd7e59e7d436ebcf20fbb0826ca0bea9d0034cf2e",
        "sha256:26db22b0172aa614822c1fb65e5784f0b75fa132993009738ffcc0920885a35b",
        "sha256:24e575986f604c9ae61005e7a8105d185a031bbca7a67d772118ad3fa6bea775",
        "sha256:ced6e2cee7147462e9eff53388dfae217e44adc81b97b65e34673f85e66b3131",
        "sha256:802d3ce78323b0cbf5a8209cdcd87cfdf3005f38a6073ff5329b390aa2e18018"
      ],
      "negative_knowledge_digests": [
        "sha256:78e1bcd08b3e18c6554d5c925ff4956ff670285c4502d3144f2fb36a1e27a7dc",
        "sha256:c383d9438a29cd6e00cd00dad548c1b81a68c203814b30b90cc48da5427fd486",
        "sha256:47139e6ca7d8f5e0920296352f406a9c7a971c2dcf3f15e4b23a22431feddbad",
        "sha256:9045091652139e48a1a2226b8a2e953f38b99787753c4476c2ed5c4bf12e95f9"
      ],
      "source_digest": "sha256:0cb658910e73ad7fde7d365eea696b175414037268269b202d00204563fb44bb",
      "task_id": "task-07-reconciliation"
    },
    {
      "assignment_id": "assignment-5b7acfa276e3cbc78b3639a0",
      "candidate_digest": "sha256:0b3576ddc8645078febcd9e92af339aaf3168e17f3154157d63e36a5a89f2cc8",
      "evidence_digests": [
        "sha256:364c9d9e824b1b5f1133580e9147f3ab61ebc5e52bb5c8b72d082ca657e38ade",
        "sha256:183c6eaf9c973ca7fa086b24bec7dcf1b3ac0ee156bbcc1f61d0b14e82378969",
        "sha256:829d2168d0a077ab79b2f000abd82cace641d71fba46878194265a039d563776",
        "sha256:cbfbf0930b5f2998ab4b6750db65417a0c75ffac1d3fe80eaa1cc701a0162702",
        "sha256:67cf9fde68d051f9ce591a4782efc51ca97e57c87fe76cf5ce191216ce13472b"
      ],
      "negative_knowledge_digests": [
        "sha256:78e1bcd08b3e18c6554d5c925ff4956ff670285c4502d3144f2fb36a1e27a7dc",
        "sha256:c383d9438a29cd6e00cd00dad548c1b81a68c203814b30b90cc48da5427fd486",
        "sha256:47139e6ca7d8f5e0920296352f406a9c7a971c2dcf3f15e4b23a22431feddbad",
        "sha256:9045091652139e48a1a2226b8a2e953f38b99787753c4476c2ed5c4bf12e95f9"
      ],
      "source_digest": "sha256:0cb658910e73ad7fde7d365eea696b175414037268269b202d00204563fb44bb",
      "task_id": "task-02-storage-mechanism"
    },
    {
      "assignment_id": "assignment-9254d98fd5a450584000fbf1",
      "candidate_digest": "sha256:d5fb9f43bc951c2f9ab3df2813897f6d0b8430c2af9a610f4a7e28270eaa1dd5",
      "evidence_digests": [
        "sha256:443bd24990788a8b2dfb4a525c1d06e0f3be33efb74631a1803de54ee5f49866",
        "sha256:64941064907c16ab6aeb8854b8dce3b73e0ad87bbb193c4eac778ea85811e548",
        "sha256:59dfe8b99edf449902df0527d9d58111fa650cc3e1140428d11db2a4c871309f",
        "sha256:7662b9a763f0288d05bb43bca40e0bd3bc706e60664fd4aafdec7f04b615c2bf"
      ],
      "negative_knowledge_digests": [
        "sha256:78e1bcd08b3e18c6554d5c925ff4956ff670285c4502d3144f2fb36a1e27a7dc",
        "sha256:c383d9438a29cd6e00cd00dad548c1b81a68c203814b30b90cc48da5427fd486",
        "sha256:47139e6ca7d8f5e0920296352f406a9c7a971c2dcf3f15e4b23a22431feddbad",
        "sha256:9045091652139e48a1a2226b8a2e953f38b99787753c4476c2ed5c4bf12e95f9"
      ],
      "source_digest": "sha256:0cb658910e73ad7fde7d365eea696b175414037268269b202d00204563fb44bb",
      "task_id": "task-04-stream-history"
    },
    {
      "assignment_id": "assignment-f655186f46609774be5e660a",
      "candidate_digest": "sha256:c736daf15cd8886edb699fde41fcf4afc495134cad13788498c54875e2cfbf23",
      "evidence_digests": [
        "sha256:7c96480e20dcba413e05648b567d80b6cc5ba7aab27f2cb5fcfed986cc4ac269",
        "sha256:bc100e71fcbeba5e5a4003fa6b9049a977e1b16b88354704c3e9c4c33d71e8e3"
      ],
      "negative_knowledge_digests": [
        "sha256:78e1bcd08b3e18c6554d5c925ff4956ff670285c4502d3144f2fb36a1e27a7dc",
        "sha256:c383d9438a29cd6e00cd00dad548c1b81a68c203814b30b90cc48da5427fd486",
        "sha256:47139e6ca7d8f5e0920296352f406a9c7a971c2dcf3f15e4b23a22431feddbad",
        "sha256:9045091652139e48a1a2226b8a2e953f38b99787753c4476c2ed5c4bf12e95f9"
      ],
      "source_digest": "sha256:0cb658910e73ad7fde7d365eea696b175414037268269b202d00204563fb44bb",
      "task_id": "task-10-boundary-isolation"
    }
  ],
  "non_canonical": true,
  "packet_id": "packet-fa4ebd5bfa75ace1debbcabf",
  "packet_label": "A",
  "pilot_id": "mth-0186",
  "pilot_kind": "agent-review-pilot",
  "promotion_boundary": {
    "canonical_cards_written": false,
    "production_records_written": false,
    "promotion_decision": "not-determined",
    "review_implies_promotion": false
  },
  "promotion_decision": "not-determined",
  "provenance": {
    "evidence_boundary": "packet A candidate statements, local evidence excerpts, scope/context, locality, and negative-knowledge references only",
    "execution_actor": "llm-based-agent",
    "human_review": false,
    "mode": "agent-review-pilot",
    "model": "not-recorded",
    "packet_selection": "A",
    "provider": "not-recorded",
    "reviewer_kind": "agent"
  },
  "record_kind": "agent-review-pilot",
  "research_only": true,
  "review_records": [
    {
      "assignment_id": "assignment-4f3b17df19521ba99739a361",
      "candidate_claim_type": "inference",
      "candidate_digest": "sha256:73129dff908acfe62341853fc949baa782be4e2e454a0b106698bd728b3103aa",